{
  "analysis_id": "BARR::E2026-01-23-001",
  "event_id": "E2026-01-23-001",
  "generated_at": "2026-05-01T16:07:43.235432+00:00",
  "barriers": [
    {
      "barrier_id": "BARRIER::PROCESS_PROCEDURE",
      "barrier_label": "Process / Procedure Barrier",
      "barrier_type": "procedural",
      "status": "unknown",
      "linked_candidate_ids": []
    }
  ],
  "summary": {
    "overall_status": "green",
    "barrier_count": 1,
    "degraded_barrier_count": 0,
    "evidence_result_count": 1
  },
  "provenance": {
    "generated_by": "RCAReasoningOrchestrator"
  }
}